{
  "type": "signalling.register",
  "version": "0.0",
  "id": "e7f8a9b0-c1d2-3e4f-5a6b-7c8d9e0f1a2b",
  "timestamp": "2026-01-05T14:00:00Z",
  "payload": {
    "agentId": "robot-001",
    "capabilities": {
      "videoCodecs": ["H264", "VP8"],
      "audioCodecs": ["opus"]
    },
    "metadata": {
      "model": "MR-5000",
      "firmwareVersion": "2.1.0"
    }
  },
  "meta": {
    "source": "robot"
  }
}
