{
  "type": "agent.location.response",
  "version": "0.1",
  "id": "f6a7b8c9-d0e1-2f3a-4b5c-6d7e8f9a0b1c",
  "correlationId": "c3d4e5f6-a7b8-9c0d-1e2f-3a4b5c6d7e8f",
  "timestamp": "2026-01-06T10:10:05Z",
  "payload": {
    "operation": "list",
    "locations": [
      {
        "name": "Warehouse Loading Dock",
        "position": {
          "x": 12.5,
          "y": 8.3,
          "z": 0.0
        },
        "orientation": {
          "yaw": 1.60,
          "pitch": 0.50,
          "roll": 0.24
        }
      },
      {
        "name": "Assembly Station 1",
        "position": {
          "x": 5.2,
          "y": 10.8
        }
      }
    ]
  }
}
